{
  "$schema": "./schema.json",
  "year": 2020,
  "season": "Summer",
  "dateTime": "2020년 8월 31일 오후 2시 ~ 오후 5시",
  "note": "2020년 신촌연합에서 진행된 ICPC Sinchon 2020 Summer Camp Contest입니다. 처음으로 문제를 새로 출제하여 진행되었습니다.",
  "links": {
    "problemBojLink": "https://www.acmicpc.net/category/794",
    "solutionPdf": "ICPC_Sinchon_2020_Summer_Camp_Contest.pdf",
    "scoreboard": [
      "https://www.acmicpc.net/contest/board/532",
      "https://www.acmicpc.net/contest/board/533"
    ]
  },
  "contest": [
    {
      "level": "초급",
      "contestName": "중간고사",
      "problemPicker": [
        {
          "name": "이길원",
          "school": "서강대학교"
        },
        {
          "name": "전해성",
          "school": "서강대학교"
        },
        {
          "name": "남수연",
          "school": "숙명여자대학교"
        }
      ],
      "awards": [
        {
          "rank": 1,
          "name": "김태윤",
          "school": "연세대",
          "bojHandle": "ystaeyoon113"
        },
        {
          "rank": 2,
          "name": "김도현",
          "school": "홍익대학교",
          "bojHandle": "swoon"
        },
        {
          "rank": 3,
          "name": "윤이빈",
          "school": "숙명여대",
          "bojHandle": "yibin99"
        }
      ]
    },
    {
      "level": "초급",
      "contestName": "기말고사",
      "awards": [
        {
          "rank": 1,
          "name": "김태윤",
          "school": "연세대",
          "bojHandle": "ystaeyoon113"
        },
        {
          "rank": 2,
          "name": "김도현",
          "school": "홍익대학교",
          "bojHandle": "swoon"
        },
        {
          "rank": 3,
          "name": "김경민",
          "school": "홍익대학교",
          "bojHandle": "kgmin604"
        }
      ],
      "problemList": [
        {
          "problemTitle": "요요 시뮬레이션",
          "link": "https://www.acmicpc.net/problem/19636",
          "setter": {
            "name": "백성익",
            "school": "홍익대학교",
            "bojHandle": "906bc"
          }
        },
        {
          "problemTitle": "IF문 좀 대신 써줘",
          "link": "https://www.acmicpc.net/problem/19637",
          "setter": {
            "name": "백성익",
            "school": "홍익대학교",
            "bojHandle": "906bc"
          }
        },
        {
          "problemTitle": "센티와 마법의 뿅망치",
          "link": "https://www.acmicpc.net/problem/19638",
          "setter": {
            "name": "백성익",
            "school": "홍익대학교",
            "bojHandle": "906bc"
          }
        },
        {
          "problemTitle": "화장실의 규칙",
          "link": "https://www.acmicpc.net/problem/19640",
          "setter": {
            "name": "백성익",
            "school": "홍익대학교",
            "bojHandle": "906bc"
          }
        },
        {
          "problemTitle": "중첩 집합 모델",
          "link": "https://www.acmicpc.net/problem/19641",
          "setter": {
            "name": "이재열",
            "school": "홍익대학교",
            "bojHandle": "malkoring"
          }
        },
        {
          "problemTitle": "TORIE",
          "link": "https://www.acmicpc.net/problem/19642",
          "setter": {
            "name": "백성익",
            "school": "홍익대학교",
            "bojHandle": "906bc"
          }
        },
        {
          "problemTitle": "좀비 떼가 전역 때보다 먼저 오다니",
          "link": "https://www.acmicpc.net/problem/19643",
          "setter": {
            "name": "백성익",
            "school": "홍익대학교",
            "bojHandle": "906bc"
          }
        },
        {
          "problemTitle": "좀비 떼가 기관총 진지에도 오다니",
          "link": "https://www.acmicpc.net/problem/19644",
          "setter": {
            "name": "백성익",
            "school": "홍익대학교",
            "bojHandle": "906bc"
          }
        }
      ]
    },
    {
      "level": "중급",
      "contestName": "중간고사",
      "problemPicker": [
        {
          "name": "이기현",
          "school": "서강대"
        },
        {
          "name": "최재민",
          "school": "KAIST"
        }
      ],
      "awards": [
        {
          "rank": 1,
          "name": "박재형",
          "school": "서강대",
          "bojHandle": "pjh6792"
        },
        {
          "rank": 2,
          "name": "남유진",
          "school": "연세대",
          "bojHandle": "youx"
        },
        {
          "rank": 3,
          "name": "박준성",
          "school": "서강대",
          "bojHandle": "wnstjd13245"
        }
      ]
    },
    {
      "level": "중급",
      "contestName": "기말고사",
      "awards": [
        {
          "rank": 1,
          "name": "김관우",
          "school": "서강대",
          "bojHandle": "rhksdn6227"
        },
        {
          "rank": 2,
          "name": "남유진",
          "school": "연세대",
          "bojHandle": "youx"
        },
        {
          "rank": 3,
          "name": "이승은",
          "school": "서강대",
          "bojHandle": "leese0425"
        }
      ],
      "problemList": [
        {
          "problemTitle": "센티와 마법의 뿅망치",
          "link": "https://www.acmicpc.net/problem/19638",
          "setter": {
            "name": "백성익",
            "school": "홍익대학교",
            "bojHandle": "906bc"
          }
        },
        {
          "problemTitle": "배틀로얄",
          "link": "https://www.acmicpc.net/problem/19639",
          "setter": {
            "name": "이준석",
            "school": "서강대학교",
            "bojHandle": "semteo04"
          }
        },
        {
          "problemTitle": "햄최몇?",
          "link": "https://www.acmicpc.net/problem/19645",
          "setter": {
            "name": "임지환",
            "school": "서강대학교",
            "bojHandle": "raararaara"
          }
        },
        {
          "problemTitle": "Random Generator",
          "link": "https://www.acmicpc.net/problem/19646",
          "setter": {
            "name": "이국렬",
            "school": "연세대",
            "bojHandle": "lky7674"
          }
        },
        {
          "problemTitle": "Unique Solution",
          "link": "https://www.acmicpc.net/problem/19647",
          "setter": {
            "name": "이국렬",
            "school": "연세대",
            "bojHandle": "lky7674"
          }
        },
        {
          "problemTitle": "미하일 2마리",
          "link": "https://www.acmicpc.net/problem/19648",
          "setter": {
            "name": "이국렬",
            "school": "연세대",
            "bojHandle": "lky7674"
          }
        },
        {
          "problemTitle": "미담 전하기",
          "link": "https://www.acmicpc.net/problem/19649",
          "setter": {
            "name": "임지환",
            "school": "서강대",
            "bojHandle": "raararaara"
          }
        },
        {
          "problemTitle": "개미여행",
          "link": "https://www.acmicpc.net/problem/19650",
          "setter": {
            "name": "이준석",
            "school": "서강대",
            "bojHandle": "semteo04"
          }
        }
      ]
    }
  ]
}
